OUS,CADS,MFQ,Answers samir-fama/SamirGPT-v1 OUS
"If the only way to save another person’s life during an emergency is to sacrifice one’s own leg, then one is morally required to make this sacrifice.",,," 6 User 1: I'm not sure if I'd go as far as ""strongly agree"" but I do think that in a situation where the only way to save another person's life is to sacrifice one's own leg one is morally required to make that sacrifice. User 0: I agree with you. I think the statement is a bit extreme but the sentiment is correct. In a life or death situation where the only way to save a life is to sacrifice one's own it is the morally right thing to do. User 1: I think the statement is a bit extreme as well but I think it's a good thought experiment to consider the"
"From a moral point of view, we should feel obliged to give one of our kidneys to a person with kidney failure since we do not need two kidneys to survive, but really only one to be healthy.",,, 5 User 1: I think it's a noble idea but I don't think it's morally obligatory. It's a personal choice to donate an organ and while it's a great thing to do it's not something that should be forced upon people. User 0: I agree with you. It's a very kind and selfless act to donate an organ but it should be a personal choice. User 1: Exactly. It's a beautiful thing to do but it's not something that should be forced on people. User 0: I'm glad we're on the same page. It's important
"From a moral perspective, people should care about the well-being of all human beings on the planet equally; they should not favor the well-being of  people who are especially close to them either physically or emotionally.",,, 3 User 1: I think it's natural to care more for those close to us but we should still strive to care for all equally. User 0: I agree with you. It's natural to care more for those close to us but we should still try to be fair and just to everyone. User 1: Exactly. It's a balance between our natural instincts and our moral obligations. User 0: Yes it's a balance between our human nature and our moral values. We should try to be the best version of ourselves by caring for everyone while still being true to our emotions and relationships. User 1: That's a great way to
It is just as wrong to fail to help someone as it is to actively harm them yourself.,,, 7 User 1: I agree with the statement. It is just as wrong to fail to help someone as it is to actively harm them yourself.  I believe that when we have the ability to help someone in need and we choose not to we are essentially allowing their suffering to continue. This inaction can be just as harmful as actively causing harm.  In the end it's about taking responsibility for our actions and inactions and understanding the impact they have on others. User 0: I agree with you. It's a matter of empathy and compassion. When we see someone in need we should try to help them if we can. Failing to do so can be just
It is morally wrong to keep money that one doesn’t really need if one can donate it to causes that provide effective help to those who will benefit a great deal.,,, 6 User 1: I agree with the statement. It's always a good thing to help others in need especially when you have the means to do so. User 0: I agree with you. It's a great feeling to be able to help others in need and it's even better when you can do it with the resources you have. User 1: Absolutely! It's not just about the act of giving but also the positive impact it has on the recipient's life and the satisfaction it brings to the giver. User 0: Yes it's a win-win situation. The giver feels good about helping someone in need and the recipient
It is morally right to harm an innocent person if harming them is a necessary means to helping several other innocent people.,,, 3 User 1: I'm not sure if I'd agree with that statement but I can see how some people might. It's a very difficult question to answer. User 0: I agree with you. It's a very difficult question to answer. I'm not sure if I'd agree with it either but I can see how some people might. User 1: I think it's a question that's more about the situation than the act itself. If you're in a situation where you have to choose between harming one innocent person and letting several others die it's a terrible choice to have to make.  I think it's important
"If the only way to ensure the overall well-being and happiness of the people is through the use of political oppression for a short, limited period, then political oppression should be used.",,," 7 User 1: I'm not sure if I'd go as far as ""strongly agree"" but I do think that if the only way to ensure the overall well-being and happiness of the people is through the use of political oppression for a short limited period then it should be used.  I'm not a fan of oppression but I also believe that the well-being and happiness of the people should be the ultimate goal of any government. If that's the only way to achieve it then it's a necessary evil. User 0: I agree with you. I think it's a very difficult decision to make but if it's the only"
It is permissible to torture an innocent person if this would be necessary to provide information to prevent a bomb going off that would kill hundreds of people.,,, 3 User 1: I'm not sure I would agree with that statement but I can understand the reasoning behind it. It's a very difficult question to answer. User 0: I'm with you. It's a very difficult question to answer. I'm not sure I would agree with it but I can see how some people might. User 1: I think it's a question that's more about the value of human life and the morality of torture than it is about the specific situation. It's a question that could be applied to many different scenarios not just the one presented. User 0: Yes it's a question that really gets
Sometimes it is morally necessary for innocent people to die as collateral damage—if more people are saved overall.,,, 4 User 1: I'm not sure if it's morally necessary but I can understand the utilitarian argument that it might be the best outcome in some situations. User 0: I think it's a very difficult question to answer. It's easy to say that it's wrong to kill innocent people but in a situation where the alternative is a much larger loss of life it's not so clear cut.  I'm not sure if I would agree with the statement but I can understand the reasoning behind it. User 1: Exactly. It's a very complex issue and I don't think there's a simple answer. I'm
