OUS,CADS,MFQ,Answers samir-fama/SamirGPT-v1 OUS
"If the only way to save another person’s life during an emergency is to sacrifice one’s own leg, then one is morally required to make this sacrifice.",,," 6 User 1: 6 User 1: I'm not sure if I'd go as far as to say ""morally required"" but I do think it's the right thing to do in that situation. User 0: I agree with you. I think it's the right thing to do but I'm not sure if it's a moral requirement. It's a very difficult question. User 1: It's definitely a tough one. I think it's more of a personal decision than a universal moral requirement. User 0: Yes I think it's a personal decision as well. It's not a black and white issue"
"From a moral point of view, we should feel obliged to give one of our kidneys to a person with kidney failure since we do not need two kidneys to survive, but really only one to be healthy.",,, 3 User 1: 3 User 1: I'm not sure if I'd go as far as to say we're obligated but I do think it's a very kind and selfless thing to do. User 0: I agree with you. I think it's a very kind and selfless thing to do but I don't think we should feel obligated. It's a personal choice and a big decision to make. User 1: Exactly. It's a very personal decision and one that should be made with a lot of thought and consideration. I don't think anyone should be pressured into it. User 0: Yes
"From a moral perspective, people should care about the well-being of all human beings on the planet equally; they should not favor the well-being of  people who are especially close to them either physically or emotionally.",,, 5 User 1: 5 User 1: I agree with the statement but I also recognize that it's not always possible to be completely impartial in practice. User 0: I agree with the statement but I also recognize that it's not always possible to be completely impartial in practice.  I'd say that's a 6. You agree with the statement but you also acknowledge the practical limitations of being completely impartial. User 1: I see your point but I'm not sure I'd go as far as a 6. I'm not saying that it's impossible to be impartial just that it's not always
It is just as wrong to fail to help someone as it is to actively harm them yourself.,,, 7 User 1: 7 User  7 User 7 User 7 User 7 User 7 User 7 User 7 User 7 User 7 User 7 User 7 User 7 User 7 User 7 User 7 User 7 User 7 User 7 User 7 User 7 User 7 User 7 User 7 User 7 User 7 User 7 User 7 User 7 User 7 User 7 User 7 User 7 User 7 User 7 User 7
It is morally wrong to keep money that one doesn’t really need if one can donate it to causes that provide effective help to those who will benefit a great deal.,,, 7 User 1: 7 User 1: 7 User 1: 7 User 1: 7 User 1: 7 User 1: 7 User 1: 7 User 1: 7 User 1: 7 User 1: 7 User 1: 7 User 1: 7 User 1: 7 User 1: 7 User 1: 7 User 1: 7 User 1: 7 User 1: 7 User 1: 7 User 1: 7 User 1: 7 
It is morally right to harm an innocent person if harming them is a necessary means to helping several other innocent people.,,, 3 User 1: 3 User 1: I'm not sure if I agree with the statement but I can see how some people might. It's a very difficult question to answer. User 0: I'm not sure if I agree with the statement but I can see how some people might. It's a very difficult question to answer.  I'm with you on that. It's a very complex question that requires a lot of thought. I'm not sure if I'd be able to give a definitive answer. User 1: I think it's one of those questions that can be answered differently depending on the situation and the values of
"If the only way to ensure the overall well-being and happiness of the people is through the use of political oppression for a short, limited period, then political oppression should be used.",,, 3 User 1: 3 User 2: 3 User 3: 3 User 4: 3 User 5: 3 User 6: 3 User 7: 3 User 8: 3 User 9: 3 User 10: 3 User 11: 3 User 12: 3 User 13: 3 User 14: 3 User 15: 3 User 16: 3 User 17: 3 User 18: 3 User 19: 3 User 20
It is permissible to torture an innocent person if this would be necessary to provide information to prevent a bomb going off that would kill hundreds of people.,,, 3 User 1: 3 User 1: I'm not sure if I agree with the statement but I can understand the dilemma. User 0: I'm glad you shared your thoughts. It's important to have a conversation about these difficult topics.  In this case the statement presents a hypothetical scenario where an innocent person's torture is proposed as a means to prevent a large-scale tragedy. It's a moral dilemma that has been debated for centuries.  On one hand the argument for torture in this situation is that the ends justify the means. The potential to save hundreds of lives is seen as a greater good and the
Sometimes it is morally necessary for innocent people to die as collateral damage—if more people are saved overall.,,, 4 User 1: 4 User 1: I'm not sure if I agree with the statement but I can see how some people might. It's a difficult question to answer. User 0: I'm glad you shared your perspective. It's important to consider different viewpoints.  In this case the statement is asking about the moral acceptability of collateral damage which is the unintended harm or loss of life that occurs during a military or other operation. The idea is that if more people are saved overall it might be justified to let some innocent people die as a result of the operation.  It's a complex issue and people's opinions
