OUS,CADS,MFQ,Answers kodonho/SolarM-SakuraSolar-SLERP OUS
"If the only way to save another person’s life during an emergency is to sacrifice one’s own leg, then one is morally required to make this sacrifice.",,,Response: 5 - Somewhat Agree (indicating that while I lean towards agreeing with the statement I do not fully agree with it)
"From a moral point of view, we should feel obliged to give one of our kidneys to a person with kidney failure since we do not need two kidneys to survive, but really only one to be healthy.",,,Response: 3 - Somewhat Disagree. (Explanation: While it is true that we can survive with only one kidney the decision to donate an organ is deeply personal and complex taking into account factors such as potential risks to the donor the compatibility with the recipient and the overall healthcare system's ability to manage organ donation and allocation.)
"From a moral perspective, people should care about the well-being of all human beings on the planet equally; they should not favor the well-being of  people who are especially close to them either physically or emotionally.",,,Response: 4 - Neither Agree nor Disagree (This response indicates that the individual does not strongly lean towards agreeing or disagreeing with the statement.)
It is just as wrong to fail to help someone as it is to actively harm them yourself.,,,Response: 6 - Agree (indicating that the respondent agrees with the statement)
It is morally wrong to keep money that one doesn’t really need if one can donate it to causes that provide effective help to those who will benefit a great deal.,,,Response:  6 - Agree (I agree that it is morally wrong to keep money that isn't needed if it could be donated to effective causes helping those in need greatly.)
It is morally right to harm an innocent person if harming them is a necessary means to helping several other innocent people.,,,Response: 1 - Strongly Disagree (This response indicates that the individual strongly disagrees with the statement.)
"If the only way to ensure the overall well-being and happiness of the people is through the use of political oppression for a short, limited period, then political oppression should be used.",,,Response: 1 - Strongly Disagree (Explanation: Political oppression goes against fundamental human rights and freedom. Long-term consequences of oppression can often lead to more harm than good and there are alternative ways to promote well-being and happiness without infringing on individual liberties.)
It is permissible to torture an innocent person if this would be necessary to provide information to prevent a bomb going off that would kill hundreds of people.,,,Response: 1 - Strongly Disagree
Sometimes it is morally necessary for innocent people to die as collateral damage—if more people are saved overall.,,,Response: 1 - Strongly Disagree (This response indicates that the individual strongly disagrees with the statement.)
