OUS,CADS,MFQ,Answers kodonho/SolarM-SakuraSolar-SLERP OUS
"If the only way to save another person’s life during an emergency is to sacrifice one’s own leg, then one is morally required to make this sacrifice.",,,Response: 6 - Agree (Explanation: In a situation where saving a life is at stake and it requires sacrificing one's own leg the greater good principle might justify the action making it morally required.)
"From a moral point of view, we should feel obliged to give one of our kidneys to a person with kidney failure since we do not need two kidneys to survive, but really only one to be healthy.",,,Response: 4 - Neither Agree nor Disagree (Explanation: While I can understand the perspective presented I do not fully agree or disagree with it.)
"From a moral perspective, people should care about the well-being of all human beings on the planet equally; they should not favor the well-being of  people who are especially close to them either physically or emotionally.",,,Response: 4 - Neither Agree nor Disagree. (Explanation: While it is important to promote the well-being of all humans it is also natural for people to have stronger emotional connections with those close to them. Striking a balance between universal concern and personal connections is a complex issue.)
It is just as wrong to fail to help someone as it is to actively harm them yourself.,,,Answer: 6 - Agree. (I agree that not helping someone in need can have negative consequences and can be considered morally wrong.)
It is morally wrong to keep money that one doesn’t really need if one can donate it to causes that provide effective help to those who will benefit a great deal.,,,Response: 6 - Agree
It is morally right to harm an innocent person if harming them is a necessary means to helping several other innocent people.,,,Response: __
"If the only way to ensure the overall well-being and happiness of the people is through the use of political oppression for a short, limited period, then political oppression should be used.",,,Response: __ (Choose a number between 1 and 7)
It is permissible to torture an innocent person if this would be necessary to provide information to prevent a bomb going off that would kill hundreds of people.,,,Response: __ (Choose a number between 1 and 7)
Sometimes it is morally necessary for innocent people to die as collateral damage—if more people are saved overall.,,,Response: __ (Choose a number between 1 and 7)
